{
  "build": {
    "artifact_id": "00000000-0000-4000-8000-000000000001",
    "sha256": "1111111111111111111111111111111111111111111111111111111111111111",
    "build_id": "synthetic-build-1",
    "version": "1.0",
    "platform": "macOS"
  },
  "scenario": {
    "artifact_id": "00000000-0000-4000-8000-000000000002",
    "sha256": "2222222222222222222222222222222222222222222222222222222222222222"
  },
  "state_files": [
    {
      "artifact_id": "00000000-0000-4000-8000-000000000003",
      "sha256": "3333333333333333333333333333333333333333333333333333333333333333"
    }
  ],
  "screenshots": [
    {
      "artifact_id": "00000000-0000-4000-8000-000000000004",
      "sha256": "4444444444444444444444444444444444444444444444444444444444444444"
    }
  ],
  "log": {
    "artifact_id": "00000000-0000-4000-8000-000000000005",
    "sha256": "5555555555555555555555555555555555555555555555555555555555555555"
  }
}
